{
	"$schema": "http://json-schema.org/draft-07/schema#",
	"$id": "https://leitvia.com/schemas/skill-scenario.json",
	"title": "Leitvia skill scenario",
	"description": "One task a human gives an agent, the ability calls that solve it without a language model and the end state they must leave. Run by packages/leitvia-skills/tests/run-scenarios.mjs against a fresh Playground. Placeholders {{capture.<name>}} in inputs take values captured by earlier steps, {{fixture:<path>}} the Base64 of a file under tests/fixtures/ and {{source}} the address of the served source.",
	"type": "object",
	"required": [ "title", "skill", "briefing", "mode", "steps", "expect" ],
	"additionalProperties": false,
	"properties": {
		"$schema": { "type": "string" },
		"title": { "type": "string", "minLength": 1, "maxLength": 120 },
		"skill": {
			"description": "Folder name of the skill under skills/, or smoke for checks of the gateway itself; equals the folder of the scenario. Scenarios under workflows/ name the workflow instead, for example new-site.",
			"type": "string",
			"pattern": "^[a-z0-9-]+$"
		},
		"briefing": {
			"description": "The task in plain English, as a human would give it to the agent.",
			"type": "string",
			"minLength": 1
		},
		"mode": {
			"description": "direct: the autonomy of the site applies. package: every write of the task goes into one change package.",
			"enum": [ "direct", "package" ]
		},
		"unattended": {
			"description": "No person answers: every checkpoint takes the answer of the section Unattended of the skill. Such a scenario has no answers and no step as admin; it ends where the skill stops without a person.",
			"type": "boolean",
			"default": false
		},
		"budget": {
			"description": "Upper limit of the context an agent loads for this case, in tokens estimated as characters / 4: the SKILL.md of the skill (or the file of the workflow), handbook/README.md and the files listed. The runner has no language model to count real tokens, so tests/unit/skills.test.mjs checks it statically.",
			"type": "object",
			"required": [ "tokens" ],
			"additionalProperties": false,
			"properties": {
				"tokens": { "type": "integer", "minimum": 1 },
				"files": {
					"description": "Further files the case needs, relative to the package, for example handbook/abilities/leitvia-apply-recipe.md.",
					"type": "array",
					"items": { "type": "string", "pattern": "^(skills|handbook|workflows)/[A-Za-z0-9./-]+\\.md$" },
					"uniqueItems": true
				}
			}
		},
		"source": {
			"description": "Folder under tests/fixtures/ with the static pages of a source site. The runner serves it over HTTP while the scenario runs; {{source}} in inputs and checks is its address.",
			"type": "string",
			"pattern": "^[a-z0-9-]+/[a-z0-9-]+$"
		},
		"tags": {
			"description": "Labels to count scenarios apart, for example commerce for scenarios that need WooCommerce.",
			"type": "array",
			"items": { "type": "string", "pattern": "^[a-z0-9-]+$" },
			"uniqueItems": true
		},
		"answers": {
			"description": "Answers of the human at the checkpoints of the skill, keyed by checkpoint. Used by agent runs, ignored by the runner.",
			"type": "object",
			"additionalProperties": { "type": "string", "minLength": 1 }
		},
		"attachments": {
			"description": "Files the person hands over with the briefing, as paths under tests/fixtures/. Agent runs copy them into the working folder of the agent; the runner ignores them.",
			"type": "array",
			"items": { "type": "string", "pattern": "^[a-z0-9-]+/[a-z0-9.-]+$" }
		},
		"setup": {
			"description": "Extra blueprint steps after dev/playground/blueprint.json, for example fixture content or WooCommerce.",
			"type": "array",
			"items": {
				"type": "object",
				"required": [ "step" ],
				"properties": { "step": { "type": "string" } }
			}
		},
		"steps": {
			"description": "Ability calls in order, made as the user agent over REST.",
			"type": "array",
			"items": {
				"type": "object",
				"required": [ "ability" ],
				"additionalProperties": false,
				"properties": {
					"ability": { "$ref": "#/definitions/ability" },
					"user": {
						"description": "admin: the person at a checkpoint, for example applying a change package. Needs a setup step that writes the application password of user 1 to /leitvia-run/admin-password.txt.",
						"enum": [ "agent", "admin" ],
						"default": "agent"
					},
					"input": { "type": "object" },
					"capture": {
						"description": "Name to dot path in the response, for example \"hash\" or \"data.current_hash\" of a rejection.",
						"type": "object",
						"additionalProperties": { "type": "string", "minLength": 1 }
					},
					"expect": { "$ref": "#/definitions/match" },
					"expectError": {
						"description": "Rejection code the call must end in.",
						"type": "string",
						"pattern": "^leitvia_[a-z_]+$"
					}
				},
				"oneOf": [
					{ "required": [ "expect" ], "not": { "required": [ "expectError" ] } },
					{ "required": [ "expectError" ], "not": { "required": [ "expect" ] } }
				]
			}
		},
		"expect": {
			"description": "End state: ability calls with expected fields, or public URLs with status, number of h1 and strings the page contains. Also checked against the result of an agent run (--expect-only).",
			"type": "array",
			"minItems": 1,
			"items": {
				"oneOf": [
					{
						"type": "object",
						"required": [ "ability", "expect" ],
						"additionalProperties": false,
						"properties": {
							"ability": { "$ref": "#/definitions/ability" },
							"input": { "type": "object" },
							"expect": { "$ref": "#/definitions/match" }
						}
					},
					{
						"type": "object",
						"required": [ "url" ],
						"additionalProperties": false,
						"properties": {
							"url": { "type": "string", "pattern": "^/" },
							"status": { "type": "integer", "default": 200 },
							"h1": { "description": "Number of h1 elements on the page.", "type": "integer", "minimum": 0 },
							"contains": {
								"description": "Strings the HTML of the page must contain, for example every sentence of a migrated post.",
								"type": "array",
								"items": { "type": "string", "minLength": 1 }
							},
							"absent": {
								"description": "Strings the HTML of the page must not contain, for example the tracker of a migrated source.",
								"type": "array",
								"items": { "type": "string", "minLength": 1 }
							}
						}
					}
				]
			}
		}
	},
	"if": { "required": [ "unattended" ], "properties": { "unattended": { "const": true } } },
	"then": {
		"not": { "required": [ "answers" ] },
		"properties": { "steps": { "items": { "properties": { "user": { "const": "agent" } } } } }
	},
	"definitions": {
		"ability": { "type": "string", "pattern": "^leitvia/[a-z0-9-]+$" },
		"match": {
			"description": "Dot path in the response to the expected value. A value is compared deeply; an object with one operator compares otherwise: $gte, $lte, $exists, $match (regular expression). The path items.length is the length of an array.",
			"type": "object",
			"additionalProperties": {
				"anyOf": [
					{
						"type": "object",
						"minProperties": 1,
						"maxProperties": 1,
						"propertyNames": { "pattern": "^\\$" },
						"properties": {
							"$gte": { "type": "number" },
							"$lte": { "type": "number" },
							"$exists": { "type": "boolean" },
							"$match": { "type": "string" }
						},
						"additionalProperties": false
					},
					{ "not": { "type": "object", "propertyNames": { "pattern": "^\\$" }, "minProperties": 1 } }
				]
			}
		}
	}
}
